{"api_version":"1.0","operation":"delivery.create","status":"planned","data":{"project":{"id":"project-id","name":"Project","path":"/workspace/Clients/Client/Projects/Project"},"manifest_path":"/workspace/Clients/Client/Projects/Project/00_Admin/project-manifest.json","delivery_path":"/workspace/Clients/Client/Projects/Project/05_Final_Delivery","delivery_notes_path":"/workspace/Clients/Client/Projects/Project/05_Final_Delivery/Delivery_Notes.md","delivery_manifest_path":"/workspace/Clients/Client/Projects/Project/05_Final_Delivery/delivery-manifest.json","revision":{"number":1,"path":"/workspace/Clients/Client/Projects/Project/04_Revisions/Revision_01"},"current_revision":2,"approved_revision":1,"delivered_revision":null,"delivery_method":"Download","workspace_path":"/workspace","replacement_mode":"default","zip_requested":false,"zip_name":null,"files_delivered":0,"selected":[{"source_name":"Project Main Mix.wav","deliverable_type":"main_mix","path":"Project Main Mix.wav"},{"source_name":"Project Stems.wav","deliverable_type":"stems","path":"Stems/Project Stems.wav"}],"excluded":[{"name":"Revision_Notes.md","reason":"revision notes"}],"deletions":[],"would_update":["/workspace/Clients/Client/Projects/Project/00_Admin/project-manifest.json","/workspace/Clients/Client/Projects/Project/05_Final_Delivery"]},"warnings":[],"errors":[]}