{"api_version":"1.0","operation":"delivery.create","status":"success","data":{"project":{"id":"project-id","name":"Project","path":"/workspace/project"},"manifest_path":"/workspace/project/00_Admin/project-manifest.json","delivery_path":"/workspace/project/05_Final_Delivery","delivery_notes_path":"/workspace/project/05_Final_Delivery/Delivery_Notes.md","delivery_manifest_path":"/workspace/project/05_Final_Delivery/delivery-manifest.json","revision":{"number":1,"path":"/workspace/project/04_Revisions/Revision_01"},"current_revision":2,"approved_revision":1,"delivered_revision":1,"delivery_method":"Download","workspace_path":"/workspace","replacement_mode":"default","zip_requested":false,"zip_name":null,"files_delivered":2,"selected":[{"source_name":"Project Main Mix.wav","deliverable_type":"main_mix","path":"Project Main Mix.wav"},{"source_name":"Project Stems.wav","deliverable_type":"stems","path":"Stems/Project Stems.wav"}],"excluded":[{"name":"Revision_Notes.md","reason":"revision notes"}],"deletions":[]},"warnings":[],"errors":[]}